[
  {
    "id": "naked-first-directions",
    "title": {
      "ko": "맨눈 1 · 이름과 방향"
    },
    "description": {
      "ko": "밝은 길잡이별과 별자리, 달을 맨눈으로 찾아보며 지도 위 이름과 실제 하늘을 연결해요. 순서는 정해져 있지 않으니 오늘 하늘에서 볼 수 있는 미션부터 골라 보세요."
    },
    "level": "naked",
    "season": "any",
    "missionIds": [
      "spring-arcturus-first",
      "spring-polaris-direction",
      "winter-sirius-beacon",
      "any-moon-phase",
      "spring-spica-bridge"
    ]
  },
  {
    "id": "naked-season-bridges",
    "title": {
      "ko": "맨눈 2 · 계절의 연결"
    },
    "description": {
      "ko": "여름에서 가을로 이어지는 하늘에서 밝은 길잡이별과 별자리를 맨눈으로 따라가며 지도 위 이름과 실제 하늘을 연결해요. 순서는 정해져 있지 않으니 오늘 볼 수 있는 미션부터 골라 보세요."
    },
    "level": "naked",
    "season": "any",
    "missionIds": [
      "summer-triangle-three",
      "summer-antares-window",
      "autumn-deneb-bridge",
      "autumn-aldebaran-arrival",
      "autumn-alpheratz-anchor"
    ]
  },
  {
    "id": "binocular-first-field",
    "title": {
      "ko": "쌍안경 1 · 시야와 안정"
    },
    "description": {
      "ko": "10×50 쌍안경의 실제 시야를 앱에 맞추고, 길잡이별에서 별무리와 성운까지 한 단계씩 비교해 가요. 순서는 정해져 있지 않으니 오늘 하늘 조건에 맞는 미션부터 골라 보세요."
    },
    "level": "binoculars",
    "season": "any",
    "missionIds": [
      "summer-vega-fov",
      "spring-m44-binocular",
      "spring-orion-color-pair",
      "any-moon-binocular",
      "summer-m13-binocular"
    ]
  },
  {
    "id": "binocular-pattern-depth",
    "title": {
      "ko": "쌍안경 2 · 배열과 공간"
    },
    "description": {
      "ko": "10×50 쌍안경으로 별의 배열을 따라가며 별무리와 성운을 길잡이별과 비교해 봐요. 순서는 정해져 있지 않으니 오늘 볼 수 있는 미션부터 골라 보세요."
    },
    "level": "binoculars",
    "season": "any",
    "missionIds": [
      "summer-deneb-starfield",
      "autumn-double-cluster",
      "winter-aldebaran-depth",
      "winter-m45-starhop",
      "winter-m42-binocular"
    ]
  },
  {
    "id": "telescope-first-record",
    "title": {
      "ko": "망원경 1 · 정렬과 기록"
    },
    "description": {
      "ko": "90mm 망원경의 낮은 배율부터 시작해 정렬과 관측, 기록을 차례로 연습해요. 사진 속 모습과 접안렌즈로 보이는 모습이 다르다는 것도 함께 익혀요. 순서는 정해져 있지 않으니 오늘 볼 수 있는 미션부터 골라 보세요."
    },
    "level": "telescope",
    "season": "any",
    "missionIds": [
      "summer-vega-align-one",
      "any-moon-first-sketch",
      "any-jupiter-visit",
      "autumn-polaris-backup",
      "spring-m3-globular"
    ]
  },
  {
    "id": "telescope-honest-view",
    "title": {
      "ko": "망원경 2 · 눈으로 본 범위"
    },
    "description": {
      "ko": "90mm 망원경으로 실제로 보이는 만큼만 보고 기록하는 연습이에요. 낮은 배율부터 시작하고, 사진 속 모습과 접안렌즈로 보이는 모습을 구분해요. 순서는 정해져 있지 않으니 오늘 볼 수 있는 미션부터 골라 보세요."
    },
    "level": "telescope",
    "season": "any",
    "missionIds": [
      "spring-polaris-center",
      "autumn-m31-core",
      "winter-rigel-scale",
      "winter-betelgeuse-record",
      "summer-albireo-double"
    ]
  }
]
